{
  "template_code": "sale_cash",
  "template_version": 1,
  "scope": [
    "retail",
    "workshop"
  ],
  "category": "sales",
  "ui": {
    "button_group_ar": "بعت",
    "display_name_ar": "بيع نقدًا",
    "icon": "cash_register",
    "description_ar": "بعت وقبضت الفلوس كاش",
    "sort_order": 1
  },
  "payment_mode": "cash",
  "requires_contact": {
    "required": false,
    "type": "customer"
  },
  "inventory_effect": "decrease",
  "allow_quick_mode": true,
  "fields": [
    {
      "key": "transaction_date",
      "type": "date",
      "label_ar": "التاريخ",
      "required": true,
      "default": "today"
    },
    {
      "key": "inventory_mode",
      "type": "toggle",
      "label_ar": "وضع تفصيلي بالأصناف؟",
      "required": true,
      "default": false
    },
    {
      "key": "items",
      "type": "item_picker",
      "label_ar": "الأصناف",
      "required": false,
      "visible_when": "inventory_mode == true"
    },
    {
      "key": "total_amount",
      "type": "amount",
      "label_ar": "المبلغ",
      "required": true,
      "visible_when": "inventory_mode == false"
    },
    {
      "key": "currency_code",
      "type": "currency_picker",
      "label_ar": "العملة",
      "required": true
    },
    {
      "key": "received_to_account",
      "type": "select",
      "label_ar": "استلمت الفلوس في؟",
      "required": true,
      "options": [
        "1101",
        "1110",
        "1120"
      ]
    },
    {
      "key": "customer_id",
      "type": "contact_picker",
      "label_ar": "العميل (اختياري)",
      "required": false
    }
  ],
  "journal_rules": [
    {
      "account_code_ref": "{{received_to_account}}",
      "side": "debit",
      "amount_formula": "total_or_items_sum()"
    },
    {
      "account_code_ref": "4150",
      "side": "credit",
      "amount_formula": "total_or_items_sum()"
    }
  ],
  "secondary_journal_rules": [
    {
      "account_code_ref": "5110",
      "side": "debit",
      "amount_formula": "cogs_amount()",
      "condition": "inventory_mode == true"
    },
    {
      "account_code_ref": "1310",
      "side": "credit",
      "amount_formula": "cogs_amount()",
      "condition": "inventory_mode == true"
    }
  ]
}
