{
  "template_code": "expense_daily",
  "template_version": 1,
  "scope": [
    "core"
  ],
  "category": "expenses",
  "ui": {
    "button_group_ar": "مصروفات",
    "display_name_ar": "مصروف يومي",
    "icon": "receipt",
    "description_ar": "مصروف يخص اليوم بس",
    "sort_order": 1
  },
  "fields": [
    {
      "key": "transaction_date",
      "type": "date",
      "label_ar": "التاريخ",
      "required": true,
      "default": "today"
    },
    {
      "key": "expense_category",
      "type": "select",
      "label_ar": "نوع المصروف",
      "required": true,
      "options": [
        {
          "value": "5201",
          "label_ar": "أجور وراتب"
        },
        {
          "value": "5401",
          "label_ar": "كهرباء ومياه"
        },
        {
          "value": "5501",
          "label_ar": "نظافة"
        },
        {
          "value": "5601",
          "label_ar": "دعاية"
        },
        {
          "value": "5801",
          "label_ar": "أخرى"
        }
      ]
    },
    {
      "key": "amount",
      "type": "amount",
      "label_ar": "المبلغ",
      "required": true
    },
    {
      "key": "currency_code",
      "type": "currency_picker",
      "label_ar": "العملة",
      "required": true
    },
    {
      "key": "paid_from_account",
      "type": "select",
      "label_ar": "دفعت من وين؟",
      "required": true,
      "options": [
        "1101",
        "1110",
        "1120"
      ]
    },
    {
      "key": "note",
      "type": "text",
      "label_ar": "بيان",
      "required": false
    }
  ],
  "journal_rules": [
    {
      "account_code_ref": "{{expense_category}}",
      "side": "debit",
      "amount_formula": "{{amount}}",
      "memo_ar": "{{note}}"
    },
    {
      "account_code_ref": "{{paid_from_account}}",
      "side": "credit",
      "amount_formula": "{{amount}}"
    }
  ]
}
