{
  "template_code": "job_expense_recovery",
  "template_version": 1,
  "scope": [
    "law_office",
    "service_office"
  ],
  "category": "services",
  "ui": {
    "button_group_ar": "نيابة عن العميل",
    "display_name_ar": "تحصيل مبلغ النيابة",
    "icon": "payment_receive",
    "description_ar": "استرجعت من العميل مبلغ كنت دفعته نيابة عنه",
    "sort_order": 5
  },
  "fields": [
    {
      "key": "transaction_date",
      "type": "date",
      "label_ar": "التاريخ",
      "required": true,
      "default": "today"
    },
    {
      "key": "job_id",
      "type": "select",
      "label_ar": "الملف/القضية",
      "required": true,
      "options_source": "open_jobs()"
    },
    {
      "key": "amount",
      "type": "amount",
      "label_ar": "المبلغ",
      "required": true
    },
    {
      "key": "currency_code",
      "type": "currency_picker",
      "label_ar": "العملة",
      "required": true
    },
    {
      "key": "received_to_account",
      "type": "select",
      "label_ar": "استلمت في؟",
      "required": true,
      "options": [
        "1101",
        "1110"
      ]
    },
    {
      "key": "receivable_account",
      "type": "select",
      "label_ar": "نوع الذمة",
      "required": true,
      "options": [
        "1640",
        "1650"
      ]
    }
  ],
  "journal_rules": [
    {
      "account_code_ref": "{{received_to_account}}",
      "side": "debit",
      "amount_formula": "{{amount}}"
    },
    {
      "account_code_ref": "{{receivable_account}}",
      "side": "credit",
      "amount_formula": "{{amount}}",
      "contact_ref": "{{job.contact_id}}"
    }
  ]
}
