{
  "template_code": "expense_period",
  "template_version": 1,
  "scope": [
    "core"
  ],
  "category": "expenses",
  "ui": {
    "button_group_ar": "مصروفات",
    "display_name_ar": "مصروف لفترة (موزّع)",
    "icon": "calendar_split",
    "description_ar": "مثل إيجار الشهر - يتوزع تلقائيًا على كل يوم",
    "sort_order": 2
  },
  "fields": [
    {
      "key": "start_date",
      "type": "date",
      "label_ar": "تاريخ البداية",
      "required": true
    },
    {
      "key": "number_of_days",
      "type": "number",
      "label_ar": "عدد الأيام",
      "required": true
    },
    {
      "key": "expense_category",
      "type": "select",
      "label_ar": "نوع المصروف",
      "required": true,
      "options": [
        "5301",
        "5601",
        "5801"
      ]
    },
    {
      "key": "total_amount",
      "type": "amount",
      "label_ar": "المبلغ الكلي",
      "required": true
    },
    {
      "key": "currency_code",
      "type": "currency_picker",
      "label_ar": "العملة",
      "required": true
    },
    {
      "key": "paid_from_account",
      "type": "select",
      "label_ar": "دفعت من وين؟",
      "required": true,
      "options": [
        "1101",
        "1110",
        "1120"
      ]
    }
  ],
  "journal_rules": [
    {
      "account_code_ref": "1410",
      "side": "debit",
      "amount_formula": "{{total_amount}}",
      "memo_ar": "دفعة مقدمة تُستهلك يوميًا"
    },
    {
      "account_code_ref": "{{paid_from_account}}",
      "side": "credit",
      "amount_formula": "{{total_amount}}"
    }
  ],
  "post_actions": [
    "create_amortization_schedule"
  ]
}
