{
  "template_code": "purchase_return",
  "template_version": 1,
  "scope": [
    "retail",
    "clinic",
    "workshop",
    "service_office"
  ],
  "category": "returns",
  "ui": {
    "button_group_ar": "مرتجعات",
    "display_name_ar": "مرتجع للمورد",
    "icon": "undo",
    "description_ar": "رجّعت بضاعة كنت اشتريتها للمورد",
    "sort_order": 2
  },
  "requires_contact": {
    "required": false,
    "type": "supplier"
  },
  "inventory_effect": "decrease",
  "fields": [
    {
      "key": "transaction_date",
      "type": "date",
      "label_ar": "التاريخ",
      "required": true,
      "default": "today"
    },
    {
      "key": "amount",
      "type": "amount",
      "label_ar": "قيمة المرتجع",
      "required": true
    },
    {
      "key": "currency_code",
      "type": "currency_picker",
      "label_ar": "العملة",
      "required": true
    },
    {
      "key": "refund_method",
      "type": "select",
      "label_ar": "كيف استرجعت الفلوس؟",
      "required": true,
      "options": [
        "cash",
        "supplier_balance"
      ]
    },
    {
      "key": "supplier_id",
      "type": "contact_picker",
      "label_ar": "المورد",
      "required": false
    }
  ],
  "journal_rules": [
    {
      "account_code_ref": "1101",
      "side": "debit",
      "amount_formula": "{{amount}}",
      "condition": "refund_method == 'cash'"
    },
    {
      "account_code_ref": "2110",
      "side": "debit",
      "amount_formula": "{{amount}}",
      "contact_ref": "{{supplier_id}}",
      "condition": "refund_method == 'supplier_balance'"
    },
    {
      "account_code_ref": "1310",
      "side": "credit",
      "amount_formula": "{{amount}}"
    }
  ]
}
