{
  "template_code": "sales_return",
  "template_version": 1,
  "scope": [
    "retail",
    "workshop"
  ],
  "category": "returns",
  "ui": {
    "button_group_ar": "مرتجعات",
    "display_name_ar": "مرتجع من عميل",
    "icon": "undo",
    "description_ar": "العميل رجّع بضاعة كان اشتراها",
    "sort_order": 1
  },
  "requires_contact": {
    "required": false,
    "type": "customer"
  },
  "inventory_effect": "increase",
  "fields": [
    {
      "key": "transaction_date",
      "type": "date",
      "label_ar": "التاريخ",
      "required": true,
      "default": "today"
    },
    {
      "key": "original_sale_ref",
      "type": "select",
      "label_ar": "الفاتورة الأصلية (اختياري)",
      "required": false,
      "options_source": "recent_sales({{customer_id}})"
    },
    {
      "key": "amount",
      "type": "amount",
      "label_ar": "قيمة المرتجع",
      "required": true
    },
    {
      "key": "currency_code",
      "type": "currency_picker",
      "label_ar": "العملة",
      "required": true
    },
    {
      "key": "refund_method",
      "type": "select",
      "label_ar": "كيف ترجع الفلوس؟",
      "required": true,
      "options": [
        "cash",
        "customer_balance"
      ]
    },
    {
      "key": "customer_id",
      "type": "contact_picker",
      "label_ar": "العميل",
      "required": false
    }
  ],
  "journal_rules": [
    {
      "account_code_ref": "4200",
      "side": "debit",
      "amount_formula": "{{amount}}",
      "memo_ar": "مردودات مبيعات"
    },
    {
      "account_code_ref": "1101",
      "side": "credit",
      "amount_formula": "{{amount}}",
      "condition": "refund_method == 'cash'"
    },
    {
      "account_code_ref": "1210",
      "side": "credit",
      "amount_formula": "{{amount}}",
      "contact_ref": "{{customer_id}}",
      "condition": "refund_method == 'customer_balance'"
    }
  ],
  "secondary_journal_rules": [
    {
      "account_code_ref": "1310",
      "side": "debit",
      "amount_formula": "cogs_amount()",
      "condition": "original_sale_ref != null"
    },
    {
      "account_code_ref": "5110",
      "side": "credit",
      "amount_formula": "cogs_amount()",
      "condition": "original_sale_ref != null"
    }
  ]
}
