{
  "template_code": "supplier_payment",
  "template_version": 1,
  "scope": [
    "core"
  ],
  "category": "settlements",
  "ui": {
    "button_group_ar": "سداد للمورد",
    "display_name_ar": "سداد دين لمورد",
    "icon": "payment_send",
    "description_ar": "دفعت فلوس لمورد كان له دين عندك",
    "sort_order": 2
  },
  "requires_contact": {
    "required": true,
    "type": "supplier"
  },
  "fields": [
    {
      "key": "transaction_date",
      "type": "date",
      "label_ar": "التاريخ",
      "required": true,
      "default": "today"
    },
    {
      "key": "supplier_id",
      "type": "contact_picker",
      "label_ar": "المورد",
      "required": true
    },
    {
      "key": "invoice_ref",
      "type": "select",
      "label_ar": "على فاتورة معينة؟ (اختياري)",
      "required": false,
      "options_source": "open_supplier_invoices({{supplier_id}})"
    },
    {
      "key": "amount",
      "type": "amount",
      "label_ar": "المبلغ",
      "required": true
    },
    {
      "key": "currency_code",
      "type": "currency_picker",
      "label_ar": "العملة",
      "required": true
    },
    {
      "key": "paid_from_account",
      "type": "select",
      "label_ar": "دفعت من وين؟",
      "required": true,
      "options": [
        "1101",
        "1110",
        "1120"
      ]
    }
  ],
  "journal_rules": [
    {
      "account_code_ref": "2110",
      "side": "debit",
      "amount_formula": "{{amount}}",
      "contact_ref": "{{supplier_id}}"
    },
    {
      "account_code_ref": "{{paid_from_account}}",
      "side": "credit",
      "amount_formula": "{{amount}}"
    }
  ],
  "post_actions": [
    "apply_fx_gain_loss_if_needed",
    "allocate_to_invoice({{invoice_ref}})"
  ]
}
