{
  "template_code": "job_expense_on_behalf",
  "template_version": 1,
  "scope": [
    "law_office",
    "service_office"
  ],
  "category": "services",
  "ui": {
    "button_group_ar": "نيابة عن العميل",
    "display_name_ar": "دفعت نيابة عن العميل",
    "icon": "receipt_send",
    "description_ar": "رسوم محكمة/حكومية دفعتها نيابة عن الموكل وسترجعها منه",
    "sort_order": 4
  },
  "fields": [
    {
      "key": "transaction_date",
      "type": "date",
      "label_ar": "التاريخ",
      "required": true,
      "default": "today"
    },
    {
      "key": "job_id",
      "type": "select",
      "label_ar": "الملف/القضية",
      "required": true,
      "options_source": "open_jobs()"
    },
    {
      "key": "amount",
      "type": "amount",
      "label_ar": "المبلغ",
      "required": true
    },
    {
      "key": "currency_code",
      "type": "currency_picker",
      "label_ar": "العملة",
      "required": true
    },
    {
      "key": "paid_from_account",
      "type": "select",
      "label_ar": "دفعت من وين؟",
      "required": true,
      "options": [
        "1101",
        "1110"
      ]
    },
    {
      "key": "receivable_account",
      "type": "select",
      "label_ar": "نوع الذمة",
      "required": true,
      "options": [
        "1640",
        "1650"
      ]
    }
  ],
  "journal_rules": [
    {
      "account_code_ref": "{{receivable_account}}",
      "side": "debit",
      "amount_formula": "{{amount}}",
      "contact_ref": "{{job.contact_id}}"
    },
    {
      "account_code_ref": "{{paid_from_account}}",
      "side": "credit",
      "amount_formula": "{{amount}}"
    }
  ]
}
