{
  "template_code": "service_revenue_cash",
  "template_version": 1,
  "scope": [
    "clinic",
    "workshop",
    "law_office",
    "service_office"
  ],
  "category": "services",
  "ui": {
    "button_group_ar": "تحصيل أتعاب",
    "display_name_ar": "تحصيل نقدًا",
    "icon": "cash_register",
    "description_ar": "قبضت قيمة الخدمة كاش",
    "sort_order": 2
  },
  "payment_mode": "cash",
  "requires_contact": {
    "required": false,
    "type": "customer"
  },
  "fields": [
    {
      "key": "transaction_date",
      "type": "date",
      "label_ar": "التاريخ",
      "required": true,
      "default": "today"
    },
    {
      "key": "job_id",
      "type": "select",
      "label_ar": "مرتبط بملف؟ (اختياري)",
      "required": false,
      "options_source": "open_jobs()"
    },
    {
      "key": "revenue_account",
      "type": "select",
      "label_ar": "نوع الإيراد",
      "required": true,
      "options_source": "revenue_accounts_for_scope()"
    },
    {
      "key": "amount",
      "type": "amount",
      "label_ar": "المبلغ",
      "required": true
    },
    {
      "key": "currency_code",
      "type": "currency_picker",
      "label_ar": "العملة",
      "required": true
    },
    {
      "key": "received_to_account",
      "type": "select",
      "label_ar": "استلمت في؟",
      "required": true,
      "options": [
        "1101",
        "1110",
        "1120"
      ]
    },
    {
      "key": "customer_id",
      "type": "contact_picker",
      "label_ar": "العميل/المريض/الموكل",
      "required": false
    }
  ],
  "journal_rules": [
    {
      "account_code_ref": "{{received_to_account}}",
      "side": "debit",
      "amount_formula": "{{amount}}"
    },
    {
      "account_code_ref": "{{revenue_account}}",
      "side": "credit",
      "amount_formula": "{{amount}}"
    }
  ]
}
