{
  "template_code": "expense_accrued",
  "template_version": 1,
  "scope": [
    "core"
  ],
  "category": "expenses",
  "ui": {
    "button_group_ar": "مصروفات",
    "display_name_ar": "مصروف مستحق (لم يُدفع)",
    "icon": "receipt_long",
    "description_ar": "مصروف استحق عليك ولسه ما دفعته (مثل راتب آخر الشهر)",
    "sort_order": 3
  },
  "fields": [
    {
      "key": "transaction_date",
      "type": "date",
      "label_ar": "التاريخ",
      "required": true,
      "default": "today"
    },
    {
      "key": "expense_category",
      "type": "select",
      "label_ar": "نوع المصروف",
      "required": true,
      "options": [
        "5201",
        "5801"
      ]
    },
    {
      "key": "amount",
      "type": "amount",
      "label_ar": "المبلغ",
      "required": true
    },
    {
      "key": "currency_code",
      "type": "currency_picker",
      "label_ar": "العملة",
      "required": true
    },
    {
      "key": "employee_id",
      "type": "contact_picker",
      "label_ar": "الموظف (إن وُجد)",
      "required": false
    }
  ],
  "journal_rules": [
    {
      "account_code_ref": "{{expense_category}}",
      "side": "debit",
      "amount_formula": "{{amount}}"
    },
    {
      "account_code_ref": "2310",
      "side": "credit",
      "amount_formula": "{{amount}}",
      "contact_ref": "{{employee_id}}"
    }
  ]
}
